Job ID,Title,Company,Work Location,Work Style,About Job,Experience required,Skills required,HR Name,HR Link,Resume,Re-posted,Date Posted,Date Applied,Job Link,External Job link,Questions Found,Connect Request
4125978764,Web Developer,BeaconFire Inc,aconFire Inc,aconFire Inc,"About the job
DESCRIPTION: BeaconFire is based in Central NJ, specializing in Software Development, Web Development, and Business Intelligence; we are looking for candidates who are passionate about combining technology and design to create user-friendly websites. 

Responsibilities: 
Develop websites using HTML, CSS, Node.js, React.js, and Angular2+, among other tools; 
Write scalable, secure, maintainable code that powers our clients’ platforms; 
Create, deploy, and maintain automated system tests; 
Work with Testers to understand defects opened and resolves them in a timely manner; 
Supports continuous improvement by investigating alternatives and technologies and presenting these for architectural review; 
Collaborate effectively with other team members to accomplish shared user story and sprint goals; 
Invest time in constant professional development to stay up to date with new technological development and programming languages; 
Discover and fix programming bugs; 
Other duties as assigned. 

Basic Qualifications: 
Proficient understanding of HTML and CSS; 
Experience in programming language JavaScript or similar (e.g. Java, Python, C, C++, C#, etc.) and understanding of the software development life cycle; 
Basic knowledge of code versioning (e.g. Git, SVN); 
A passion for coding pixel perfect web pages; 
Good verbal communication and interpersonal skills. 

Preferred Qualifications: 
Bachelor's degree or higher in Computer Science or related fields; 
0-1 year of practical experience in JavaScript coding; 
Familiarity with at least one JavaScript framework (Angular2+, React.js, Express.js); 
Experience with unit and integration testing of code, with an understanding of JavaScript testing frameworks like Jasmine, Cucumber, Mocha, and Karma; 
Experience providing REST/SOAP APIs for user interface consumption; 
Experience working within an Agile development methodology Scrum. 

Compensation: $65,000.00 to $80,000.00 /year

BeaconFire is an E-verified company and provides equal employment opportunities (visa sponsorship provided).",0,Needs an AI,Alexander C. ,https://www.linkedin.com/in/alexander-c-a420ba234,Previous resume,True,2025-02-03 22:00:44.069715,Pending,https://www.linkedin.com/jobs/view/4125978764,Easy Applied,set(),In Development
4146077337,Junior Web Developer,Lexid,xid,xid,"About the job
Junior Web Developer – Internship with Potential Full-time Offer

 Location: Barcelona

 Type: Internship (Part-time or Full-time) - ""Convenio de Universidad""

 Opportunity: Possibility of full-time contract

About The Role

We are looking for a student Web Developer to support the development and maintenance of a new web-based project. The role involves working on the initial setup, customization, and ongoing improvements of a modular web application, ensuring scalability, performance, and seamless integrations between different tools and platforms.

In addition to core development tasks, this position requires working with APIs and automation tools to optimize workflows and improve efficiency. The selected candidate will gain practical experience in a real-world development environment, with the possibility of long-term collaboration.

What You Will Be Doing

Development & Maintenance:

Implement and refine a scalable web application from its early stages
Work with modern web technologies to build, optimize, and maintain core features
Ensure the application is secure, modular, and easy to maintain

Integrations & Workflow Automation:

Develop API-based connections between different tools and services
Work with automation platforms to streamline internal processes
Implement event-driven logic to improve efficiency

Bug Fixing & Continuous Improvement:

Identify, debug, and resolve technical issues
Optimize backend queries and front-end performance
Collaborate on UI/UX improvements and user workflows

Required Skills & Experience

Technical Skills:

Experience with modern JavaScript frameworks (e.g., React, Next.js, Vue)
Understanding of databases (Supabase, SQL, NoSQL, or similar)
Familiarity with APIs, webhooks, and serverless functions
Exposure to authentication and role-based access control
Some knowledge of automation tools (Zapier, Make, etc.) is a plus
Basic experience with Git and version control workflows

Soft Skills & Mindset:

Strong analytical and problem-solving skills
Ability to work independently and proactively
Willingness to learn and adapt in a fast-moving environment
Good communication and teamwork skills

&#128077;&#127996; Nice-to-Have (But Not Required)

Experience with payment integrations and subscription models
Understanding of serverless and cloud-based architectures
Interest in scaling and optimizing web applications

&#129299; What a Typical Day Looks Like

Start the day reviewing tasks and priorities in our internal system
Develop or refine features for an internal web tool, ensuring efficiency for legal professionals
Work on API integrations between platforms to automate processes
Implement simple workflow automations using Zapier to reduce manual work
Debug and optimize existing functionalities, ensuring performance and reliability
Participate in brief check-ins with the team, aligning on progress and next steps
Document key updates and improvements before wrapping up the day
Manage and optimize development databases, ensuring data consistency and performance

We look after our employees by creating a professional and personal development space. All employees are encouraged to be free thinkers and suggest solutions that could benefit the company. We believe that a warm and friendly work environment helps to promote a general sense of peace of mind, which is essential to our client's satisfaction. Lastly, at Lexidy, ties are banned, and it is mandatory to have fun!

At Lexidy inclusion and diversity are essential. We encourage people from all ethnic groups, genders, sexuality, age, and abilities to apply. We want to hear from you!

Powered by JazzHR

Qva9jdJnm6",0,Needs an AI,Unknown,Unknown,Previous resume,False,2025-02-06 22:00:55.008989,2025-02-09 22:01:19.183430,https://www.linkedin.com/jobs/view/4146077337,Easy Applied,"{('Do you live in Barcelona? [  ""Yes""<Yes>, ""No""<No>, ]', '""Yes""<Yes>', 'radio', '""Yes""<Yes>'), ('Do you live in Barcelona? [  ""Yes""<Yes>, ""No""<No>, ]', 'Yes', 'radio', None), ('zip / postal code', '11865', 'text', '11865'), ('mobile phone number', '01116851157', 'text', '01116851157'), ('Email address [  ""Select an option"", ""chiiit1754@gmail.com"", ]', 'Yes', 'select', 'chiiit1754@gmail.com'), ('last name', 'Khaled', 'text', 'Khaled'), ('what are your salary expectations?', '20000', 'text', ''), ('how many years of experience do you have with python and r?', '2', 'text', '2'), ('what are your salary expectations?', '20000', 'text', '20000'), ('Do you have experience with Python? [  ""Yes""<Yes>, ""No""<No>, ]', 'Yes', 'radio', None), ('first name', 'Mostafa', 'text', 'Mostafa'), ('state', 'shubra el kheima', 'text', 'shubra el kheima'), ('do you have a degree? which one?', '', 'textarea', ''), ('Do you have experience with Python? [  ""Yes""<Yes>, ""No""<No>, ]', '""Yes""<Yes>', 'radio', '""Yes""<Yes>'), ('Phone country code [ ""List of phone country codes"" ]', 'Yes', 'select', 'Egypt (+20)'), ('how many years of experience do you have with python and r?', '2', 'text', ''), ('street address line 1', 'cairo001', 'text', 'cairo001'), ('city', 'Cairo, Egypt', 'text', '')}",In Development
4145864274,Software Developer - (Frontend),Qatar Living,tar Living,tar Living,"About the job
Qatar Living is looking for a highly skilled and experienced Frontend Software Developer with a strong background in Javascript, Typescript, ReactJS, NextJS, MUI, and SEO. The ideal candidate will have a passion for creating high-quality, responsive, and user-friendly interfaces. You will work closely with our design and backend teams to translate Figma designs into fully functional web applications. Your expertise in modern frontend development, along with your experience in tools like Git, Jira, and unit testing, will be crucial in delivering top-notch products.

Key Responsibilities:
• Develop and maintain high-performance web applications using ReactJS and NextJS.
• Translate Figma designs into responsive, interactive, and pixel-perfect UIs.
• Implement SEO best practices to ensure high visibility and ranking in search engines.
• Collaborate with designers, backend developers, and other stakeholders to deliver a seamless user experience.
• Write clean, maintainable, and testable code following industry best practices.
• Conduct unit testing to ensure the quality and functionality of the codebase.
• Manage version control and collaboration using Git.
• Track progress and manage tasks effectively using Jira.
• Stay up-to-date with the latest industry trends, tools, and technologies to continuously improve the frontend development process.
A transferable QID/visa (NOC should be readily available)

Qualifications:
• 5+ years of professional experience in frontend development.
• Proficient in ReactJS and NextJS with a solid understanding of component-based architecture.
• Strong experience in implementing SEO strategies and techniques in web applications.
• Proven track record of developing user interfaces from Figma or similar design tools.
• Familiarity with version control using Git and experience in working with collaborative code repositories.
• Strong understanding of unit testing frameworks and tools.
• Excellent problem-solving skills and attention to detail.
• Strong communication skills and ability to work collaboratively in a team environment.

Preferred Qualifications:
• Experience with other frontend technologies and frameworks (e.g., Angular, Redux, Google maps).
• Knowledge of accessibility standards and practices.
• Familiarity with CI/CD pipelines and deployment processes.",5,Needs an AI,Unknown,Unknown,Previous resume,False,2025-02-09 15:01:48.638671,2025-02-09 22:01:51.125010,https://www.linkedin.com/jobs/view/4145864274,Easy Applied,"{('what is your monthly salary expectation in qatari riyals ?', '1666.67', 'text', ''), ('how many years of work experience do you have with application configuration?', '2', 'text', ''), ('how many years of work experience do you have with react.js?', '2', 'text', '2'), ('how many years of information technology experience do you currently have?', '1', 'text', '1'), ('mobile phone number', '01116851157', 'text', '01116851157'), ('Email address [  ""Select an option"", ""chiiit1754@gmail.com"", ]', 'Yes', 'select', 'chiiit1754@gmail.com'), ('Phone country code [ ""List of phone country codes"" ]', 'Yes', 'select', 'Egypt (+20)')}",In Development
4142373776,Web Developer,Inventum Grou,ventum Grou,ventum Grou,"About the job
Job Title: Full Stack Web Developer/Engineer
Location: Nicosia, Cyprus
Industry: Financial Services, Fintech 
Type: Full-time
Salary: €40,000 - €45,000 depending on experience

Company Overview:
We are exclusively partnered with an innovative and fast-growing Fintech firm headquartered in Nicosia, Cyprus. Our client specialises in providing cutting-edge cloud based solutions to businesses globally, and are on an exciting growth period, they are looking to add a Full Stack Web Developer to join their team.

Candidate overview:
The ideal candidate will be a highly resourceful and innovative full stack developer with extensive experience in the layout, design and coding of websites. 

Main responsabilities:
Coding signed-off designs into working pages and components of a ReactJS web application (including styling with CSS/SASS) and integrating those into a web portal. 
Project management, managing estimates, and timescales.
Provide functional and techical support
Examine and maintain the business model and make any recommended changes. 
Design and create test scripts, perform quality testing and support business owner acceptance testing.
Ensure IT processes are in line iwth Business objectives
Work cross-functionally to convert business needs into technical specifications


Qualifications
Strong relevant industry experience
Minimum 2 years of experience
Fluent in English (written and spoken)
Good communication skills
Confident and competent developer
Experience with JavaScript, ReactJS, HTML, CSS/SASS. (Node.js would be considered an advantage)
Good knowledge of relational and non-relational databases (PostgreSQL) and writing complex queries
Strong experience with Data Analysis, Data Profiling, Data Cleansing, Data Reconciliation and Data Integrity using SQL, Shell scripts and other approved tools
Familiarity with GIT source control will be considered as an advantage

ED&I:
Inventum Group is passionate about equity, diversity and inclusion. We seek individuals from the widest talent pool and encourage underrepresented talent to apply for vacancies with us. We are committed to recruitment processes that are fair for all, regardless of background and personal characteristics. If you require any adjustments to apply for a role with us, please let us know in whatever way suits you best.",2,Needs an AI,Vaki Zeniou ,https://www.linkedin.com/in/vaki-zeniou-616226102,Previous resume,False,2025-02-05 22:01:59.731616,Pending,https://www.linkedin.com/jobs/view/4142373776,Easy Applied,set(),In Development
4140717606,Web Developer,Astrey,trey,trey,"About the job
This is full time role, working within one of the world's most recognisable technology companies.

It will be office based 5 days a week, in central Amsterdam.

We are looking to recruit a number of developers at varying levels, Salaries will be very competitive, 

Responsibilities:
Translate requirements to software design and create clean, efficient, extensible, maintainable code.
Build responsive and dynamic front-end interfaces with React.js & similar frameworks, adhering to best practices in user experience and accessibility.
Write clean, efficient, and well-documented code, following coding standards and guidelines.
Work closely with product managers, UX designers, and other engineers to deliver features and improvements.
Develop and maintain unit, integration, and end-to-end tests.
Identify and resolve performance bottlenecks and system issues.
Collaborate effectively with cross-functional partners to develop innovative solutions that adhere to development goals and principles.
Manage project features, break into sub-tasks, identify and resolve issues for efficient execution.
Contribute to code reviews for immediate team and other teams, participate in reviewing ADRs (Architecture Decision Records).

Skill Sets:
Strong proficiency in front-end technologies, particularly JavaScript, Node.js, and React.js.
3 to 5 years of experience designing front-end systems and development using JavaScript/Typescript, React, NodeJS, Server-side rendering using one of the open-sourced UI libraries (Material UI/Angular Material), integration with REST/GraphQL APIs
Experience with e2e testing (Cypress)
Experience building/setting-up shared component libraries
Experience building/setting-up application builds (server and client)
Successful history of designing and building scalable, distributed and high-available systems. Have critical thought and opinion on how Web Frontend systems should work and be integrated with Backend APIs to ensure high-performant, responsive website and accessibility.
Experience taking a lead role delivering complex software systems through collaboration across disciplines including Product and UX.
Experience in BEM-structured CSS, Webpack and Express.js.
DevOps experience, CI/CD mindset, using Jenkins to automate application/library builds, releases, PR validations
Experience with WebSockets and/or WebRTC
Experiences in contributing to common (open source) libraries/tools/components is a plus.",3,Needs an AI,Rob Gapp ,https://www.linkedin.com/in/rob-gapp-79bb0021,Previous resume,True,2025-02-05 22:02:08.551286,2025-02-09 22:02:11.350551,https://www.linkedin.com/jobs/view/4140717606,Easy Applied,"{('how many years of work experience do you have with node.js?', '0', 'text', '0'), ('how many years of work experience do you have with react.js?', '2', 'text', '2'), ('Are you comfortable commuting to this job\'s location? [  ""Yes""<Yes>, ""No""<No>, ]', 'Yes', 'radio', None), ('mobile phone number', '01116851157', 'text', '01116851157'), ('Email address [  ""Select an option"", ""chiiit1754@gmail.com"", ]', 'Yes', 'select', 'chiiit1754@gmail.com'), ('Are you legally authorized to work in Netherlands? [  ""Yes""<Yes>, ""No""<No>, ]', 'Yes', 'radio', None), ('Phone country code [ ""List of phone country codes"" ]', 'Yes', 'select', 'Egypt (+20)')}",In Development
4145890176,Senior Frontend Developer,2P Perfect Presentatio,Perfect Presentatio, Perfect Presentatio,"About the job
🚀 We Are Hiring: Senior Frontend Developer (React)

Are you a Senior React Developer looking for your next challenge? Do you thrive in building high-performance, user-friendly web applications? If so, we want YOU on our team at 2P!

Why Join Us?

At 2P, we are committed to innovation, excellence, and delivering cutting-edge digital solutions. We empower our employees with a collaborative environment where your work directly contributes to our clients' success.

Job Title: Senior Frontend Developer – React
📍 Location: (On-site)
📅 Experience: 5+ years

Job Overview

As a Senior Frontend Developer (React), you will be responsible for designing, developing, and optimizing high-performance web applications. You will work closely with backend developers and UX/UI designers to ensure seamless user experiences while maintaining best coding practices and performance standards.

Key Responsibilities
🔹 Frontend Development
Develop, optimize, and maintain modern React.js applications.
Implement reusable components and frontend logic to enhance user experience.
Build responsive and cross-browser compatible web applications.
🔹 Performance & Optimization
Optimize application performance, ensuring fast load times and a seamless UI.
Use state management tools such as Redux, Zustand, or Context API efficiently.
🔹 Code Quality & Best Practices
Write clean, maintainable, and scalable code following best practices.
Conduct code reviews and mentor junior developers.
🔹 Collaboration & Teamwork
Work closely with backend developers, UI/UX designers, and product managers.
Ensure smooth integration with APIs and third-party services.
🔹 Testing & Debugging
Perform unit and integration testing using tools like Jest, Mocha, or Cypress.
Debug and resolve frontend issues to maintain application stability.

Required Qualifications

✔ Education: Bachelor’s degree in Computer Science, Software Engineering, or a related field.
✔ Experience: 5-7 years of hands-on experience in frontend development.
✔ Technical Skills:
Strong proficiency in React.js, React Hooks, Redux, and Context API.
Proficiency in JavaScript (ES6+), TypeScript, and modern frontend build tools (Webpack, Babel, Vite).
Experience with CSS frameworks (Tailwind, Bootstrap, Material-UI) and preprocessors (SASS, LESS).
Knowledge of RESTful APIs and WebSockets for efficient data handling.
Familiarity with Agile/Scrum methodologies.
✔ Nice to Have:
Experience with Next.js for server-side rendering (SSR).
Familiarity with testing frameworks (Jest, Enzyme, Cypress).
Exposure to cloud platforms (AWS, Azure, Firebase) is a plus.

Key Performance Indicators (KPIs)
📌 Code quality and maintainability
📌 Application performance and load times
📌 UI/UX responsiveness and accessibility
📌 Effective collaboration with backend and design teams
📌 Timely feature delivery and debugging efficiency

What We Offer
🌟 Competitive salary package 💰
🌟 Career growth opportunities 📈
🌟 Collaborative and innovative work environment 🤝

Ready to Elevate Your Career? 🚀
If you're passionate about frontend development and love React, we’d love to hear from you!
📩 Apply now and be part of an exciting journey at 2P!",5,Needs an AI,Unknown,Unknown,Previous resume,False,2025-02-09 21:02:18.941141,2025-02-09 22:02:21.804259,https://www.linkedin.com/jobs/view/4145890176,Easy Applied,"{('Have you integrated RESTful APIs and WebSockets into web applications? [  ""Select an option"", ""Yes"", ""No"", ]', 'Yes', 'select', 'Select an option'), ('how many years of work experience do you have with redux.js?', '1', 'text', '1'), ('how many years of work experience do you have with react.js?', '2', 'text', '2'), ('Have you worked with CSS frameworks like Tailwind, Bootstrap, or Material-UI? [  ""Select an option"", ""Yes"", ""No"", ]', 'Yes', 'select', 'Select an option'), ('mobile phone number', '01116851157', 'text', '01116851157'), ('Email address [  ""Select an option"", ""chiiit1754@gmail.com"", ]', 'Yes', 'select', 'chiiit1754@gmail.com'), ('Do you have a Bachelor’s degree in Computer Science or a related field? [  ""Select an option"", ""Yes"", ""No"", ]', 'Yes', 'select', 'Select an option'), ('how many years of software development experience do you currently have?', '2', 'text', ''), ('how soon would you be able to join if you were offered this position?, in days', '2', 'text', ''), ('how many years of experience do you have in frontend development?', '2', 'text', ''), ('what are your salary expectations for this role?, in egp', '20000', 'text', ''), ('Phone country code [ ""List of phone country codes"" ]', 'Yes', 'select', 'Egypt (+20)'), ('how many years of work experience do you have with next.js?', '1', 'text', '1')}",In Development
