Job ID,Title,Company,Work Location,Work Style,About Job,Experience required,Skills required,HR Name,HR Link,Resume,Re-posted,Date Posted,Date Applied,Job Link,External Job link,Questions Found,Connect Request
4143429522,Frontend Developer,Addison Grou,dison Grou,dison Grou,"About the job
We are looking for an experienced and passionate Front-End Developer to join our dynamic development team. As a Front-End Developer, you will design, develop, and maintain scalable and user-friendly web applications. You will work closely with stakeholders, end-users, and other team members to create intuitive solutions while adhering to best practices in performance, security, and accessibility.

Key Responsibilities:
UI/UX Development: Design and implement scalable, intuitive, and clean front-end solutions for web applications.
Collaboration: Collaborate with stakeholders, designers, and end-users to gather requirements and ensure user needs are met effectively.
Code Quality: Write maintainable, high-quality code, perform code reviews, and ensure high testing coverage for reliability.
API Integration: Work with REST and GraphQL APIs for data fetching and state management.
Performance Optimization: Optimize the application for speed, responsiveness, and overall user experience.
Accessibility: Implement inclusive designs and ensure adherence to web accessibility standards.
Continuous Improvement: Stay updated with the latest front-end trends and technologies, applying improvements where necessary.
Mentorship: Guide and mentor junior developers, fostering a collaborative and learning-oriented environment.

Required Qualifications:
Education:
Preferred: Bachelor’s degree in Computer Science, Engineering, IT, or a related field.
Alternatively: Equivalent practical experience and proven expertise in front-end development.
Experience:
3+ years of hands-on front-end development experience using React, TypeScript, and Sass.
Expertise in modern build tools such as Vite or Webpack.
Strong proficiency in responsive design, performance optimization, and accessibility best practices.
Familiarity with front-end security best practices.
Experience working with design systems and component libraries.
Proficient in Git, including branching strategies and code reviews.
Technical Skills:
Strong experience with React, TypeScript, and CSS pre-processors (e.g., Sass).
Solid knowledge of Redux for state management.
Familiarity with AG Grid for advanced data grid implementations.
Expertise in GraphQL for efficient data querying.
Experience working with Material UI for consistent, reusable design components",3,Needs an AI,Kendall Montgomery Gross,https://www.linkedin.com/in/kendall-montgomery-gross-3a06aa8b,Previous resume,False,2025-02-04 21:42:45.323984,2025-02-09 21:42:47.788897,https://www.linkedin.com/jobs/view/4143429522,Easy Applied,"{('Are you legally authorized to work in the United States? [  ""Yes""<Yes>, ""No""<No>, ]', 'Yes', 'radio', None), ('mobile phone number', '01116851157', 'text', '01116851157'), ('Email address [  ""Select an option"", ""chiiit1754@gmail.com"", ]', 'Yes', 'select', 'chiiit1754@gmail.com'), ('Will you now, or in the future, require sponsorship for employment visa status (e.g. H-1B visa status)? [  ""Yes""<Yes>, ""No""<No>, ]', '""No""<No>', 'radio', '""No""<No>'), ('Phone country code [ ""List of phone country codes"" ]', 'Yes', 'select', 'Egypt (+20)')}",In Development
4141137211,Frontend Developer,Botkeepe,tkeepe,tkeepe,"About the job
We’re looking for an experienced Frontend Engineer to join our mission of building the future of bookkeeping! Simplicity and efficiency are at the core of every product we build at botkeeper. As a frontend engineer you’ll be expected to carry this mantra into your daily development by building, extending, and scaling products that streamline the bookkeeping and practice management processes. 

We are a high growth startup, so you need to be a self-starter who is comfortable with some level of ambiguity when it comes to requirements, and is able to quickly iterate on ideas; we move fast, and you’ll need to keep up. Startup life isn’t for everyone, but if you are hungry to make an impact and be surrounded by others who are dedicated to their craft we would love to talk to you. 

Responsibilities:
Taking designs/mocks and architecting a code structure to maximize maintainability and efficiency
Develop frontend systems with an emphasis on user-friendliness, developer-friendliness, robustness, and maintainability
Work with product teams and end users in order to understand user interactions and build scalable solutions for improving customer’s workflow and experiences
Establish processes for ensuring maintainability of new code and bringing old code into new standards via refactor and replacement
Actively contribute to our code review culture
Qualifications:
5+ years of shipping software in a professional team setting
4+ years of experience with ReactJS
2+ years of experience with NodeJs
Knowledge of React Query
Experience with React v16+
Experience with architecture
Proficient knowledge of NPM, webpack, Git and other frontend development tools
Experience in communicating with users, other technical teams, and management to collect requirements, identify tasks, provide estimates and meet production deadlines
Curious about how things work, creative about how to approach problems, and eager to collaborate with others",5,Needs an AI,Unknown,Unknown,Previous resume,False,2025-02-03 21:42:54.856760,2025-02-09 21:42:56.828414,https://www.linkedin.com/jobs/view/4141137211,Easy Applied,"{('how many years of work experience do you have with react.js?', '2', 'text', '2'), ('how many years of work experience do you have with javascript?', '2', 'text', '2'), ('mobile phone number', '01116851157', 'text', '01116851157'), ('Email address [  ""Select an option"", ""chiiit1754@gmail.com"", ]', 'Yes', 'select', 'chiiit1754@gmail.com'), ('Phone country code [ ""List of phone country codes"" ]', 'Yes', 'select', 'Egypt (+20)')}",In Development
4118612001,React Js Developer,Synechro,nechro,nechro,"About the job
We have an Immediate Job opportunity for React Js Developer

Job Role: React Js Developer
Job Location: Riyadh, Saudi Arabia
Experience : 5 to 12 Years
Notice Period: Immediate to 60 days

About Company
At Synechron, we believe in the power of digital to transform businesses for the better. Our global consulting firm combines creativity and innovative technology to deliver industry-leading digital solutions. Synechron’s progressive technologies and optimization strategies span end-to-end Artificial Intelligence, Consulting, Digital, Cloud & DevOps, Data, and Software Engineering, servicing an array of noteworthy financial services and technology firms. Through research and development initiatives in our FinLabs we develop solutions for modernization, from Artificial Intelligence and Blockchain to Data Science models, Digital Underwriting, mobile-first applications and more. Over the last 20+ years, our company has been honored with multiple employer awards, recognizing our commitment to our talented teams. With top clients to boast about, Synechron has a global workforce of 13,950+, and has 52 offices in 20 countries within key global markets. For more information on the company, please visit our website or LinkedIn communit

Diversity, Equity, and Inclusion
Diversity & Inclusion are fundamental to our culture, and Synechron is proud to be an equal opportunity workplace and an affirmative-action employer. Our Diversity, Equity, and Inclusion (DEI) initiative ‘Same Difference’ is committed to fostering an inclusive culture – promoting equality, diversity and an environment that is respectful to all. We strongly believe that a diverse workforce helps build stronger, successful businesses as a global company. We encourage applicants from across diverse backgrounds, race, ethnicities, religion, age, marital status, gender, sexual orientations, or disabilities to apply. We empower our global workforce by offering flexible workplace arrangements, mentoring, internal mobility, learning and development programs, and more. All employment decisions at Synechron are based on business needs, job requirements and individual qualifications, without regard to the applicant’s gender, gender identity, sexual orientation, race, ethnicity, disabled or veteran status, or any other characteristic protected by l

Job Description
Developing new user-facing features using React. js
Building reusable components and front-end libraries for future use
Creating designs and wireframes and translate them to high quality code
Optimizing components for maximum performance across a vast array of web-capable devices and browsers
Code Deployments to AWS Services like ECS, EC2, Docker containers Skills
Strong proficiency in JavaScript, including DOM manipulation and the JavaScript object model
Thorough understanding of React. js and its core principles
Experience with popular React. js workflows (such as Flux or Redux)
Familiarity with newer specifications of EcmaScript
Experience with data structure libraries (e. g. , Immutable. js)
Knowledge of isomorphic React is a plus
Familiarity with RESTful APIs
Knowledge of modern authorization mechanisms, such as JSON Web Token
Familiarity with modern front-end build pipelines and tools
Experience with common front-end development tools such as Babel, Webpack, NPM, etc.
Ability to understand business requirements and translate them into technical requirements
A knack for benchmarking and optimization
Familiarity with code versioning tools (such as Git, SVN, and Mercurial)

Qualifications:
Bachelor’s degree in computer science or related field.

Soft Skills:
Excellent communication and leadership skills.
Strong interpersonal and collaboration skills.
Ability to work under pressure and meet tight deadlines.
Positive attitude and strong work ethic.",5,Needs an AI,Unknown,Unknown,Previous resume,True,2025-02-04 21:43:04.330133,2025-02-09 21:43:06.129768,https://www.linkedin.com/jobs/view/4118612001,Easy Applied,"{('mobile phone number', '01116851157', 'text', '01116851157'), ('Email address [  ""Select an option"", ""chiiit1754@gmail.com"", ]', 'Yes', 'select', 'chiiit1754@gmail.com'), ('Phone country code [ ""List of phone country codes"" ]', 'Yes', 'select', 'Egypt (+20)')}",In Development
4144409947,Frontend Developer – Zurich,Noi,i,i,"About the job
Frontend Developer – Fintech Start Up – Zurich, Switzerland

(Tech stack: Front End Developer, JavaScript, HTML5, CSS3, Angular, KnockoutJS, BackboneJS, React, Angular, VueJS, jQuery Typescript, Web, UI, UX, User Interface, User Experience, Front End Developer)

We have several fantastic new roles for Front End Developer to join an ambitious Fintech start-up. This is your chance to work with the sharpest minds in private wealth management and financial software development. Our client’s latest product release has changed the way people view private wealth management and allowed them to provide their clients with an individualised, scalable asset management framework that is unrivalled in today’s market place.

It takes a team to make things happen and this team includes some of the most talented Front End Developer (JavaScript, jQuery, Angular) in the industry. This is your opportunity to be part of a new, technically challenging project and to be involved in the creation of a new application from scratch. FinTech is booming and our client are fast becoming a leader of this market!

They are looking for Front End Developer with experience in some or all of the following (full training will be provided to fill any gaps in your skill set): JavaScript, LESS, SASS, ES6, HTML5, CSS3, Angular, KnockoutJS, BackboneJS, React, VueJS, jQuery, Typescript and AJAX.

All Front-End Developer positions come with the following benefits:
Shares in the company.
Pension scheme (8%).
3 hours ‘free time’ each week to investigate new technologies.
An annual training allowance of CHF 4.5k.
30 days holiday (excluding Bank Holidays) plus your birthday off.
Flexible working hours.
Work from home.
Pizza and beer Fridays.
Access to free yoga classes which take place over lunch or after work in their fitness studio.

It’s an incredible opportunity so if you’re interested, act and apply today!

Location: Zurich , Switzerland / Remote Working

Salary: CHF 110,000 - CHF 130,000 + Bonus + Pension + Benefits

NOIREURGENSP1
NOIRSWITZERLANDREC
NOIREUROPEREC

NC/HT/ZUR1030",0,Needs an AI,Ben Keilty ,https://www.linkedin.com/in/benkeilty,Previous resume,False,2025-02-05 21:43:11.413448,2025-02-09 21:43:14.090694,https://www.linkedin.com/jobs/view/4144409947,Easy Applied,"{('Email [  ""Select an option"", ""chiiit1754@gmail.com"", ]', 'Yes', 'select', 'chiiit1754@gmail.com'), ('Phone country code [ ""List of phone country codes"" ]', 'Yes', 'select', 'Egypt (+20)'), ('phone', '01116851157', 'text', '01116851157')}",In Development
4134240255,Front-End Developer (React),Expert Executive Recruiters (EER Global,pert Executive Recruiters,EER Global,"About the job
Front-End Developer (React)

Our client is seeking a talented and passionate Front-End Developer with at least 3 years of experience in React. If you thrive in a fast-paced, collaborative environment, this role offers a unique opportunity to contribute to cutting-edge AI-driven products and solutions.

Key Responsibilities
Build, develop and maintain intuitive, responsive, and pixel perfect user interfaces using React.
Work closely with designers, back-end developers, and product managers to create seamless user experiences.
Ensure high performance of the application across devices and browsers, focusing on speed and scalability, optimising performance.
Collaborate with AI specialists to integrate machine learning models and AI-powered functionalities into the front-end.
Write clean, maintainable, and well-documented code following best practice.

Required Qualifications
Experience: Minimum 3 years of professional experience with 
React Technical Skills:
Proficiency in HTML, CSS3, and JavaScript (ES6+).
Strong expertise in React, including hooks, state management, and component lifecycles.
Familiarity with modern CSS frameworks or pre-processors (e.g., Sass, Tailwind CSS).
Strong analytical and problem-solving skills with attention to detail.
Excellent communication skills and the ability to work collaboratively in a team environment.

Preferred Qualifications
Knowledge of TypeScript or other strongly typed languages.
Experience with testing frameworks like Jest, React Testing Library, or Cypress.
Familiarity with RESTful APIs and GraphQL.
Exposure to AI concepts such as machine learning, natural language processing
Experience with design tools (e.g., Figma, Adobe XD) and translating designs into functional components.

What They Offer
Innovative Projects: Work on AI-driven products that push boundaries of technology.
Professional Growth: Opportunities for training to advance your skills.
Flexible Work Environment: Remote work options to support work-life balance.
Collaborative Culture: Join a team of like-minded individuals passionate about innovation and technology.
Competitive Compensation: Attractive salary and benefits package",3,Needs an AI,Julia Foerster ,https://www.linkedin.com/in/juliafoerster,Previous resume,True,2025-02-07 21:44:09.745514,2025-02-09 21:44:11.942945,https://www.linkedin.com/jobs/view/4134240255,Easy Applied,"{('What is your level of proficiency in English? [  ""Select an option"", ""None"", ""Conversational"", ""Professional"", ""Native or bilingual"", ]', 'Yes', 'select', 'Conversational'), ('how many years of work experience do you have with react.js?', '2', 'text', '2'), ('mobile phone number', '01116851157', 'text', '01116851157'), ('Email address [  ""Select an option"", ""chiiit1754@gmail.com"", ]', 'Yes', 'select', 'chiiit1754@gmail.com'), ('how many years of work experience do you have with front-end development?', '1', 'text', '1'), ('Phone country code [ ""List of phone country codes"" ]', 'Yes', 'select', 'Egypt (+20)')}",In Development
4143813502,Junior React Developer,Pathfinder - IT Recruitmen,thfinder - IT Recruitmen,thfinder - IT Recruitmen,"About the job
Junior React Developer
Fully Remote (UK-based candidates only) 

Are you a junior developer with a passion for React.js, Node.js, and JavaScript? Looking for your first or second role where you can build real-world software and develop your skills in a supportive environment?

Join a well-established data analytics SaaS company, part of a respected US software group, where you’ll work on Jira customisation projects that make a real impact.

The Role
You'll be working alongside experienced developers to customise and extend Jira's functionality using React.js, Node.js, JavaScript, and TypeScript. This is a great opportunity to build on your hands-on experience with real projects, learn best practices, and grow your technical skills.

What You’ll Do
Develop and modify React.js components for Jira customisations.
Assist in backend development and integrations using Node.js.
Work on feature development and UI enhancements.
Learn from experienced developers and develop your coding best practices.

What We’re Looking For
Some experience with React.js, JavaScript, and Node.js, ideally gained in a professional setting.
Enthusiasm for problem-solving, learning new technologies, and writing clean code.
Graduate or graduate calibre, with qualifications in a relevant subject
Comfortable working remotely. 
Strong aptitude for problem solving, proactivity, teamwork and above all, great communication skills. 

💡 Looking for your next step in development? Apply now!",0,Needs an AI,Unknown,Unknown,Previous resume,False,2025-02-05 21:44:19.436367,2025-02-09 21:44:21.968584,https://www.linkedin.com/jobs/view/4143813502,Easy Applied,"{('how many years of work experience do you have with node.js?', '0', 'text', '0'), ('how many years of work experience do you have with react.js?', '2', 'text', '2'), ('mobile phone number', '01116851157', 'text', '01116851157'), ('Email address [  ""Select an option"", ""chiiit1754@gmail.com"", ]', 'Yes', 'select', 'chiiit1754@gmail.com'), ('Are you comfortable working in a remote setting? [  ""Yes""<Yes>, ""No""<No>, ]', '""Yes""<Yes>', 'radio', '""Yes""<Yes>'), ('Will you now or in the future require sponsorship for employment visa status? [  ""Yes""<Yes>, ""No""<No>, ]', 'No', 'radio', None), ('how many years of work experience do you have with api development?', '0', 'text', '0'), ('Phone country code [ ""List of phone country codes"" ]', 'Yes', 'select', 'Egypt (+20)')}",In Development
4143810304,React Developer,Pathfinder - IT Recruitmen,thfinder - IT Recruitmen,thfinder - IT Recruitmen,"About the job
React Developer – Jira Projects
Fully Remote (UK-based candidates only)

Are you a React Developer with strong Node.js skills, looking for a role where you can work on cutting-edge Jira customisation projects? Join a well-established retail data analytics SaaS company, part of a respected US software group, and help shape solutions that enhance Jira for enterprise customers.

The Role
We're looking for a developer with React.js, Node.js, JavaScript and TypeScript expertise to customise and extend Jira's functionality. You'll work on feature development, integrations, and UI enhancements to meet business needs.

What You’ll Do
Build and modify React.js components for Jira customisations.
Develop backend integrations and APIs using Node.js.
Enhance Jira workflows and extend functionality to meet customer requirements.
Write clean, maintainable code and collaborate with a cross-functional team and key customer stakeholders.

What We’re Looking For
Strong React.js and Node.js development experience is essential.
Proficiency in JavaScript and TypeScript.
Knowledge of REST APIs and integrations.
Self-motivated, problem-solving mindset, and great communication skills.
User experience with Jira would be useful
Jira development/customisation would be very handy too, but not essential.

💡 Passionate about React, Node.js, and solving real-world problems? Apply now and be part of something exciting!",0,Needs an AI,Kieran Delaney,https://www.linkedin.com/in/thekierandelaney,Previous resume,False,2025-02-05 21:44:27.163106,Pending,https://www.linkedin.com/jobs/view/4143810304,Easy Applied,set(),In Development
4145556389,React JS Developer,ORO24 Development,O24 Development,O24 Development,"About the job
Position Overview:
We are looking for an experienced React.js Developer who is proficient in building modern web applications. The ideal candidate will have a strong understanding of React.js principles and best practices, as well as experience working with other technologies such as Redux, Complex Forms and RESTful APIs. As a React.js Developer, you will collaborate with cross-functional teams to design and implement innovative solutions that meet our business needs.

Responsibilities:
Develop responsive and intuitive front-end interfaces using React.js.
Collaborate with designers to implement UI/UX designs and ensure a seamless user experience.
Build and maintain reusable React.js components and libraries for use across the application.
Implement complex forms, user authentication, and role-based access control (RBAC) systems.
Integrate third-party APIs into the React.js application for data retrieval and manipulation.
Optimize application performance for maximum speed and scalability.
Ensure cross-browser compatibility and responsiveness of the application.
Understanding of typescript is a plus .
Conduct code reviews, write unit tests (jest , mock ) and debug issues to ensure high quality and reliability.
Stay up-to-date with the latest trends and best practices in front-end development and contribute to continuous improvement of our development processes.

  Requirements:

Bachelor's degree in Computer Science, Engineering, or a related field.
Proven 5+ years of experience working as a React.js Developer.
Proficient in JavaScript, HTML, CSS, and related web technologies.
Experience with form management libraries such as Formik or React Hook Form.
Experience in user authentication and role-based access control (RBAC) systems.
Must have a strong grip on creating custom responsive UI designs.
Strong understanding of React.js and its core principles.
Experience with state management libraries in React.js.
Familiarity with modern front-end build pipelines and tools.
Excellent problem-solving and analytical skills.
Strong communication and collaboration abilities.
Ability to work independently and in a team environment.
Experience with agile development methodologies is a plus.




Why Work with us !

At ORO24, we pride ourselves on a multicultural, fun and talented team of people. You will have a chance to work with a visionary leader, passionately driven colleagues and a highly entrepreneurial leadership team. 🌍

Ideas, innovations, challenges, extraordinary, it is all in your day to day. 💡

You will work in a modern, stylish and beautiful office designed to offer an exceptional work environment for our stars to shine. All work and no play makes anyone a dull person, so we play music throughout the office - why not enjoy while we work on our goals? 🎶

The ORO24 office also offers you a state-of-the-art gym- to get those pre/post office workouts in without an additional trip to the gym. A library and an in-house cafe with subsidized meals and an excellent barista that makes someone amazing brews are just some of the other amazing features of our office. 💪📚☕

Besides this, we have an in-house nurse who does regular wellness checks and referrals for all employees to ensure our awesome team is always in the peak of health. 🩺

And last but not the least, ORO24 is on a blazing path of success and if you decide to jump onboard with us, we guarantee you will be in for an excellent journey with us. 🚀

If you're ready to take the next step in your career, apply now or tag someone who might be a perfect fit!",5,Needs an AI,Unknown,Unknown,Previous resume,False,2025-02-06 21:44:38.881889,2025-02-09 21:44:41.127252,https://www.linkedin.com/jobs/view/4145556389,Easy Applied,"{('how many years of real estate experience do you currently have?', '0', 'text', '0'), ('how many years of work experience do you have with react.js?', '2', 'text', '2'), ('how many years of work experience do you have with javascript?', '2', 'text', '2'), ('mobile phone number', '01116851157', 'text', '01116851157'), ('Email address [  ""Select an option"", ""chiiit1754@gmail.com"", ]', 'Yes', 'select', 'chiiit1754@gmail.com'), ('how many years of engineering experience do you currently have?', '1', 'text', '1'), ('Have you completed the following level of education: Bachelor\'s Degree? [  ""Yes""<Yes>, ""No""<No>, ]', '""Yes""<Yes>', 'radio', '""Yes""<Yes>'), ('how many years of computer and network security experience do you currently have?', '2', 'text', ''), ('Phone country code [ ""List of phone country codes"" ]', 'Yes', 'select', 'Egypt (+20)')}",In Development
