Job ID,Title,Company,Work Location,Work Style,About Job,Experience required,Skills required,HR Name,HR Link,Resume,Re-posted,Date Posted,Date Applied,Job Link,External Job link,Questions Found,Connect Request
4144418698,Javascript Developer,Delta Software Armeni,lta Software Armeni,lta Software Armeni,"About the job
We are seeking a javascript developer with Caspio knowledge to join our team and work on interesting projects. 
You will be responsible for the user interface of our website. 
Qualified candidates will be expected to have a working knowledge of HTML5, CSS, and JavaScript.

 Qualifications
Bachelor's degree in computer science
Experience developing modern, responsive, and cross-browser-compatible websites using HTML, CSS, and JavaScript
Experience with JavaScript libraries such as jQuery and Bootstrap
Experience with cross-browser compatibility testing
Good problem-solving skills.
Excellent verbal communication skills.
Good interpersonal skills.
Good understanding of HTTP requests
Good level of both verbal and written English",0,Needs an AI,Unknown,Unknown,Previous resume,False,2025-02-05 21:46:34.057246,2025-02-09 21:46:36.769301,https://www.linkedin.com/jobs/view/4144418698,Easy Applied,"{('What is your level of proficiency in English? [  ""Select an option"", ""None"", ""Conversational"", ""Professional"", ""Native or bilingual"", ]', 'Yes', 'select', 'Conversational'), ('what are your salary expectations per month in amd?', '1666.67', 'text', ''), ('how many years of work experience do you have with javascript?', '2', 'text', '2'), ('mobile phone number', '01116851157', 'text', '01116851157'), ('Email address [  ""Select an option"", ""chiiit1754@gmail.com"", ]', 'Yes', 'select', 'chiiit1754@gmail.com'), ('Do you have a degree in computer science or a related field? [  ""Select an option"", ""Yes"", ""No"", ]', 'Yes', 'select', 'Select an option'), ('Have you completed the following level of education: Bachelor\'s Degree? [  ""Yes""<Yes>, ""No""<No>, ]', '""Yes""<Yes>', 'radio', '""Yes""<Yes>'), ('Are you comfortable working with pure Javascript without using frameworks? [  ""Select an option"", ""Yes"", ""No"", ]', 'Yes', 'select', 'Select an option'), ('Phone country code [ ""List of phone country codes"" ]', 'Yes', 'select', 'Egypt (+20)')}",In Development
4084203173,Front-end Developer,Odiin,iin,iin,"About the job
Responsibilities:
Develop and implement new user-facing features for products with significant daily page views.
Write client-side code to create fast, intuitive web-based applications for both desktop and mobile browsers, including hybrid in-app pages.
Optimize web applications to ensure high performance and scalability.
Build and maintain libraries and frameworks to support complex web applications, streamline development processes, and enhance code quality.
Requirements:
5+ years of experience in writing production-level JavaScript, with strong proficiency in React.
Familiarity with state management patterns like Redux, Flux, or similar frameworks.
Proven experience in delivering high-quality user interfaces.
A Bachelor’s or Master’s degree in Computer Science, Engineering, or equivalent professional experience.
Expertise in developing responsive websites for a wide range of devices, from desktops to mobile platforms.
Experience with modern front-end tools and technologies such as Styled System, Webpack, etc.",5,Needs an AI,Unknown,Unknown,Previous resume,True,2025-01-10 21:47:20.695954,2025-02-09 21:47:22.598407,https://www.linkedin.com/jobs/view/4084203173,Easy Applied,"{('mobile phone number', '01116851157', 'text', '01116851157'), ('Email address [  ""Select an option"", ""chiiit1754@gmail.com"", ]', 'Yes', 'select', 'chiiit1754@gmail.com'), ('Phone country code [ ""List of phone country codes"" ]', 'Yes', 'select', 'Egypt (+20)')}",In Development
4042552861,Frontend JavaScript/Typescript Developer,YO IT CONSULTIN,IT CONSULTIN, IT CONSULTIN,"About the job
LLM JavaScript / TypeScript Engineer

Experience: 2 - 5 Years

Location- Permanent Remote Anywhere in the world

Contract Duration: 6 Months

Opportunity- Full Time, 8 hours, Overlap Required: 5 hours PST

Total Years Of exp- 2+ years experience

Mandatory Skills- JavaScript: 2, Typescript: 2

About The Role

We are actively seeking talented developers proficient in Javascript/Typescript to join our ambitious team dedicated to pushing the frontiers of AI technology. This opportunity is tailored for professionals who thrive on developing innovative solutions and aspire to be at the forefront of AI advancements. You will work with different companies in the US who are looking to develop cutting-edge commercial and research AI solutions.

Required Skills

Write readable, reusable, and maintainable code
Participate in code reviews to ensure that the standards for code quality are met
Demonstrate your proficiency with your language of choice, while covering all bases
Provide clear, clean, well-organized, correct, and clearly annotated/classifiable code in the responses
Bachelor’s/Master’s degree in Engineering, Computer Science (or equivalent experience)
At least 2+ years of relevant experience as a front-end engineer
Demonstrable experience with developing web apps using modular development and scalable architectures as well as a strong focus on code readability and security/stability (i.e. testing)
Proficiency with the language's syntax and conventions
Extensive experience working with JavaScript or TypeScript
Solid understanding of JavaScript ES6 and either Node.js or React
Nice to have some prior software Quality Assurance and Test Planning experience
Excellent spoken and written English communication skills

Skills: software quality assurance,front-end engineer,react,react.js,quality assurance,front-end web development,web apps,english communication,security,code quality,javascript es6,frontend development,modular development,es6,engineering,scalable architectures,web apps development,test planning,javascript,code reviews,typescript,node.js,computer science,scalable architecture,code security,front-end,security/stability,web development,code readability,testing,communication skills",2,Needs an AI,Unknown,Unknown,Previous resume,False,2024-09-12 21:47:34.559561,2025-02-09 21:47:37.668931,https://www.linkedin.com/jobs/view/4042552861,Easy Applied,"{('how many years of experience do you have in javascript?', '2', 'text', ''), ('how many years of experience do you have in frontend development ?', '2', 'text', ''), ('mobile phone number', '01116851157', 'text', '01116851157'), ('Email address [  ""Select an option"", ""chiiit1754@gmail.com"", ]', 'Yes', 'select', 'chiiit1754@gmail.com'), ('last name', 'Khaled', 'text', 'Khaled'), ('how many years of experience do you have in typescript?', '2', 'text', ''), ('unknown', '2', 'text', ''), ('first name', 'Mostafa', 'text', 'Mostafa'), ('what is your expected per hour rate in usd?\ufeff or mention your per month expectation in usd', '2', 'text', ''), ('Phone country code [ ""List of phone country codes"" ]', 'Yes', 'select', 'Egypt (+20)'), ('what is your current rate?(per hour/month in usd)', '2', 'text', ''), ('Are you ok with the Contract Role? Contract Duration 6 Months [  ""Yes""<Yes>, ""No""<No>, ]', 'Yes', 'radio', None)}",In Development
4142614671,Frontend (ReactJS) Developer,Direct Resource Solution,rect Resource Solution,rect Resource Solution,"About the job
Title: Frontend (ReactJS) Developer
Location: Remote (work from home)
Duration: Full time

Experience in Chakra UI.
Experience in ReactJS
Experience in java Script
You will be responsible for designing, developing, testing, and debugging responsive web and mobile.
applications for the company. Using JavaScript, HTML, and CSS, this candidate will translate user and
business needs into functional front-end design.
Responsibilities
Designing, developing, and testing UI for mobile and web applications
Build reusable code and libraries for future use!
Accurately translate user and business needs into functional frontend code
Using JavaScript, HTML, and CSS, this candidate will translate user and business needs into functional frontend design.
You will be responsible for designing, developing, testing, and debugging responsive web and mobile applications for the company
Build reusable code and libraries for future use.
Accurately translate user and business needs into functional frontend code
Qualifications
Bachelor's degree or equivalent in Computer Science is ideal
Experience in frontend development.
Experience building object-oriented web applications in ReactJS, JavaScript, VueJS, HTML5, SASS and CSS3
Experience with TypeScript
Familiarity using Scrum/Agile development methodologies.
Nice-to-have skills
Web/graphics design",0,Needs an AI,Taylor Boon,https://www.linkedin.com/in/taylor-boon-51778132a,Previous resume,False,2025-02-03 21:47:42.859244,Pending,https://www.linkedin.com/jobs/view/4142614671,Easy Applied,set(),In Development
4073956731,Frontend JavaScript/Typescript/Node.js Developer,YO IT CONSULTIN,IT CONSULTIN, IT CONSULTIN,"About the job
LLM JavaScript / TypeScript Engineer

Experience: 2 - 5 Years

Location- Permanent Remote Anywhere in the world

Contract Duration: 6 Months

Opportunity- Full Time, 8 hours, Overlap Required: 5 hours PST

Total Years Of exp- 2+ years experience

Mandatory Skills- JavaScript: 2, Typescript: 

2About The Rol

eWe are actively seeking talented developers proficient in Javascript/Typescript to join our ambitious team dedicated to pushing the frontiers of AI technology. This opportunity is tailored for professionals who thrive on developing innovative solutions and aspire to be at the forefront of AI advancements. You will work with different companies in the US who are looking to develop cutting-edge commercial and research AI solutions

.Required Skill

sWrite readable, reusable, and maintainable cod
eParticipate in code reviews to ensure that the standards for code quality are me
tDemonstrate your proficiency with your language of choice, while covering all base
sProvide clear, clean, well-organized, correct, and clearly annotated/classifiable code in the response
sBachelor’s/Master’s degree in Engineering, Computer Science (or equivalent experience
)At least 2+ years of relevant experience as a front-end enginee
rDemonstrable experience with developing web apps using modular development and scalable architectures as well as a strong focus on code readability and security/stability (i.e. testing
)Proficiency with the language's syntax and convention
sExtensive experience working with JavaScript or TypeScrip
tSolid understanding of JavaScript ES6 and either Node.js or Reac
tNice to have some prior software Quality Assurance and Test Planning experienc
eExcellent spoken and written English communication skill

sSkills: front-end web development,frontend development,code readability,web apps development,react.js,engineering,modular development,node.js,scalable architectures,software quality assurance,quality assurance,code review,test planning,code reviews,testing,react,typescript,web apps,javascript,computer science,web development,es6,web app development,readability,code quality",2,Needs an AI,Unknown,Unknown,Previous resume,False,2024-12-11 21:47:53.294218,2025-02-09 21:47:56.402305,https://www.linkedin.com/jobs/view/4073956731,Easy Applied,"{('how many years of experience do you have in javascript?', '2', 'text', ''), ('how many years of experience do you have in frontend development ?', '2', 'text', ''), ('mobile phone number', '01116851157', 'text', '01116851157'), ('Email address [  ""Select an option"", ""chiiit1754@gmail.com"", ]', 'Yes', 'select', 'chiiit1754@gmail.com'), ('last name', 'Khaled', 'text', 'Khaled'), ('how many years of experience do you have in typescript?', '2', 'text', ''), ('unknown', '2', 'text', ''), ('first name', 'Mostafa', 'text', 'Mostafa'), ('how many years of experience do you have in node js development ?', '2', 'text', ''), ('what is your expected per hour rate in usd?\ufeff or mention your per month expectation in usd', '2', 'text', ''), ('Phone country code [ ""List of phone country codes"" ]', 'Yes', 'select', 'Egypt (+20)'), ('what is your current rate?(per hour/month in usd)', '2', 'text', ''), ('Are you ok with the Contract Role? Contract Duration 6 Months [  ""Yes""<Yes>, ""No""<No>, ]', 'Yes', 'radio', None)}",In Development
4042554659,Frontend JavaScript/Typescript Developer,YO IT CONSULTIN,IT CONSULTIN, IT CONSULTIN,"About the job
LLM JavaScript / TypeScript Engineer

Experience: 2 - 5 Years

Location- Permanent Remote Anywhere in the world

Contract Duration: 6 Months

Opportunity- Full Time, 8 hours, Overlap Required: 5 hours PST

Total Years Of exp- 2+ years experience

Mandatory Skills- JavaScript: 2, Typescript: 2

About The Role

We are actively seeking talented developers proficient in Javascript/Typescript to join our ambitious team dedicated to pushing the frontiers of AI technology. This opportunity is tailored for professionals who thrive on developing innovative solutions and aspire to be at the forefront of AI advancements. You will work with different companies in the US who are looking to develop cutting-edge commercial and research AI solutions.

Required Skills

Write readable, reusable, and maintainable code
Participate in code reviews to ensure that the standards for code quality are met
Demonstrate your proficiency with your language of choice, while covering all bases
Provide clear, clean, well-organized, correct, and clearly annotated/classifiable code in the responses
Bachelor’s/Master’s degree in Engineering, Computer Science (or equivalent experience)
At least 2+ years of relevant experience as a front-end engineer
Demonstrable experience with developing web apps using modular development and scalable architectures as well as a strong focus on code readability and security/stability (i.e. testing)
Proficiency with the language's syntax and conventions
Extensive experience working with JavaScript or TypeScript
Solid understanding of JavaScript ES6 and either Node.js or React
Nice to have some prior software Quality Assurance and Test Planning experience
Excellent spoken and written English communication skills

Skills: react,web apps development,code security,security,software quality assurance,web apps,frontend development,web development,es6,testing,communication skills,modular development,test planning,english communication,node.js,code readability,front-end engineer,code quality,computer science,scalable architectures,javascript,typescript,front-end web development,react.js,scalable architecture,engineering,quality assurance",2,Needs an AI,Unknown,Unknown,Previous resume,False,2024-09-12 21:48:03.555735,2025-02-09 21:48:06.602189,https://www.linkedin.com/jobs/view/4042554659,Easy Applied,"{('how many years of experience do you have in javascript?', '2', 'text', ''), ('how many years of experience do you have in frontend development ?', '2', 'text', ''), ('mobile phone number', '01116851157', 'text', '01116851157'), ('Email address [  ""Select an option"", ""chiiit1754@gmail.com"", ]', 'Yes', 'select', 'chiiit1754@gmail.com'), ('last name', 'Khaled', 'text', 'Khaled'), ('how many years of experience do you have in typescript?', '2', 'text', ''), ('unknown', '2', 'text', ''), ('first name', 'Mostafa', 'text', 'Mostafa'), ('what is your expected per hour rate in usd?\ufeff or mention your per month expectation in usd', '2', 'text', ''), ('Phone country code [ ""List of phone country codes"" ]', 'Yes', 'select', 'Egypt (+20)'), ('what is your current rate?(per hour/month in usd)', '2', 'text', ''), ('Are you ok with the Contract Role? Contract Duration 6 Months [  ""Yes""<Yes>, ""No""<No>, ]', 'Yes', 'radio', None)}",In Development
4142266205,Website Optimisation Manager (CRO),Palm Outsourcin,lm Outsourcin,lm Outsourcin,"About the job
Working Days and Hours: Monday to Friday, 9 AM - 5:30 PM (UK Hours); Potential for Flexible Hours
Location: Remote/Online
Salary Range: Attractive Top of Market Salary (paid in GBP/USD)


Palm Outsourcing helps international companies find talent in Egypt.

Please note, we will only be considering excellent applicants with solid demonstrable experience. If you do not have clear and evidenced experience, you will be immediately rejected, so please do not apply.

Contrastingly if you feel you are a right fit relative to the requirements below, please proceed.


Opportunity Overview
Our client is a well-established e-commerce brand in the home and lifestyle sector, offering a broad range of innovative products. Their online platform allows consumers to purchase high-quality lifestyle solutions quickly and efficiently. With a commitment to sustainability and customer satisfaction, they aim to enhance everyday life through practical and stylish product offerings. This role presents an exciting opportunity to play a key part in optimizing digital performance and enhancing the customer journey. As a Website Optimisation Manager (CRO) you will be responsible for increasing conversion rates across multiple websites within the group, driving data-driven improvements, and collaborating with design and development teams to implement impactful changes.


Role Description
We’re looking for a CRO Manager to join our client’s team. If you're an analytical and results-driven professional with a passion for website optimization and data-backed decision-making, this could be the opportunity you’ve been looking for. You’ll take ownership of conversion rate optimization efforts, oversee testing programs, and lead strategic initiatives to enhance user experience and site performance.
This position offers significant opportunities for personal and professional growth within a dynamic and fast-paced e-commerce environment.


Key Responsibilities
CRO Strategy & Execution – Develop and implement a comprehensive CRO strategy to enhance website conversion rates and overall user experience.
A/B Testing & Experimentation – Design, set up, and execute A/B and multivariate tests to identify high-impact changes that improve conversions.
Performance Analysis & Insights – Analyze site performance using analytics tools (e.g., Google Analytics, Hotjar, Optimizely) to identify bottlenecks, opportunities, and trends.
Collaboration with Design & Development – Brief and coordinate with UX designers and developers to implement CRO recommendations and ensure seamless execution.
User Experience & Funnel Optimization – Identify pain points in the customer journey and suggest improvements to enhance engagement, reduce drop-offs, and maximize conversions.
Data-Driven Decision Making – Regularly report on testing outcomes and key performance indicators, providing actionable insights for continuous improvement.
Stakeholder Communication – Present findings and recommendations to senior stakeholders, ensuring CRO initiatives align with broader business goals.


Minimum Qualifications
Experience & Expertise – 5+ years of experience in CRO, digital optimization, or a similar role, with a proven track record of running successful testing programs.
Analytical Skills – Strong ability to interpret data from Google Analytics, Hotjar, A/B testing tools, and other performance measurement platforms.
Ownership & Initiative – Comfortable taking full responsibility for CRO results and proactively driving improvements.
Technical & UX Knowledge – Understanding of UX principles, website functionality, and front-end development constraints.
Communication & Collaboration – Excellent English communication skills, with the ability to work effectively across teams and present complex insights in an accessible way.


Company Benefits
Top-of-the-market pay.
Remote working.
Potential for flexible hours.
Becoming a part of Palm Outsourcing, where your performance is rewarded in long-term job security and continued growth opportunities.

This is a fantastic opportunity for a CRO professional to make a direct impact on an e-commerce brand’s success while working in a collaborative and growth-focused environment.

Thank you for taking the time to apply, we look forward to reviewing your application.",5,Needs an AI,Unknown,Unknown,Previous resume,False,2025-02-03 21:48:14.160871,2025-02-09 21:48:16.521291,https://www.linkedin.com/jobs/view/4142266205,Easy Applied,"{('What is your level of proficiency in English? [  ""Select an option"", ""None"", ""Conversational"", ""Professional"", ""Native or bilingual"", ]', 'Yes', 'select', 'Conversational'), ('mobile phone number', '01116851157', 'text', '01116851157'), ('Email address [  ""Select an option"", ""chiiit1754@gmail.com"", ]', 'Yes', 'select', 'chiiit1754@gmail.com'), ('how many years of work experience do you have with funnel optimization?', '2', 'text', ''), ('how many years of work experience do you have with data-driven decision making?', '2', 'text', ''), ('Phone country code [ ""List of phone country codes"" ]', 'Yes', 'select', 'Egypt (+20)'), ('how many years of work experience do you have with a/b testing?', '2', 'text', '')}",In Development
4148039456,Facility Maintenance Engineer,Methode Electronic,thode Electronic,thode Electronic,"About the job
Duties and Responsibilities:
Assists in taking decisions on all normal/minor issues and report.
Maintains and performs minor repairs to equipment using general power and hand tools and other equipment as may be necessary.
Maintaining proper Preventive Maintenance Records.
Work within Environmental and Health & Safety requirements procedures.
Work within the Quality Management System requirements and procedures including Certification and Customer requirements.
Assistance in achieving production goals.

Qualifications:
Engineering Degree, and at least 3 years’ experience in machinery maintenance.
Oral and written skills, strong interpersonal skills and organizational abilities.
Ability to take initiative, to maintain confidentiality, to meet deadlines, and to work in a team environment is essential.
Ability to be flexible and multitasking.
Methodical approach, enthusiastic with an emphasis on accuracy and quality of work.
Goal Oriented Self Motivator.
Excellent Communicator.
PC-based computing experience is essential.",3,Needs an AI,Passant Gazouli ,https://www.linkedin.com/in/passant-gazouli-304a10a3,Previous resume,False,2025-02-09 13:48:32.848107,2025-02-09 21:48:35.319361,https://www.linkedin.com/jobs/view/4148039456,Easy Applied,"{('mobile phone number', '01116851157', 'text', '01116851157'), ('Email address [  ""Select an option"", ""chiiit1754@gmail.com"", ]', 'Yes', 'select', 'chiiit1754@gmail.com'), ('how many years of work experience do you have with facilities?', '2', 'text', ''), ('how many years of work experience do you have with facility management (fm)?', '2', 'text', ''), ('how many years of engineering experience do you currently have?', '1', 'text', '1'), ('Phone country code [ ""List of phone country codes"" ]', 'Yes', 'select', 'Egypt (+20)')}",In Development
